{
  "name": "hierarchical_agent_files_init",
  "title": "Hierarchical Agent File Scaffold",
  "description": "Scaffold a two-level parent + children agent-file hierarchy in one shot. Delegates per-node base scaffolding to agent_files_init (from the agent-files skill) and patches each node with hierarchy-specific clauses: a slim or verified child AGENT.md (parent-first read order, precedence, update routing back to parent, boundary), a parent-outer-boundary constraint in each child AGENT_GOAL.md, the progress-scope rule in the parent AGENT_HARNESS.md, and a parent AGENT_PROGRESS.md Completed Changes seed written only after all child contracts succeed.",
  "inputSchema": {
    "type": "object",
    "properties": {
      "parent_dir": {
        "type": "string",
        "minLength": 1,
        "description": "Directory where the parent four-file agent contract is scaffolded."
      },
      "parent_mission": {
        "type": "string",
        "minLength": 1,
        "description": "One- or two-sentence long-term mission statement written into the parent AGENT_GOAL.md. Required so the scaffolded contract is internally consistent on first read; must not include workflow preferences, current state, next steps, or transient objectives."
      },
      "parent_objective": {
        "type": "string",
        "minLength": 1,
        "description": "Optional transient in-flight objective for the parent AGENT_PROGRESS.md. Must not define permanent mission, scope, policy, or success criteria. If omitted, the Current Objective section is removed by agent-files rather than left as a placeholder."
      },
      "parent_name": {
        "type": "string",
        "minLength": 1,
        "description": "Short name used in child cross-references (e.g., in the child precedence block). Defaults to basename(parent_dir) with trailing slash stripped."
      },
      "children": {
        "type": "array",
        "minItems": 1,
        "description": "List of direct-child nested workspaces to scaffold under parent_dir.",
        "items": {
          "type": "object",
          "properties": {
            "relative_dir": {
              "type": "string",
              "minLength": 1,
              "pattern": "^(?!\\.\\.?$)(?!.*\\.\\.)(?![A-Za-z]:)[^/\\\\]+$",
              "description": "Child folder name relative to parent_dir. Must be a single path segment: no slashes, no '..', not absolute."
            },
            "mission": {
              "type": "string",
              "minLength": 1,
              "description": "One- or two-sentence long-term mission statement written into this child's AGENT_GOAL.md. Must stay within the parent mission and avoid workflow/current-state details."
            },
            "objective": {
              "type": "string",
              "minLength": 1,
              "description": "Optional transient in-flight objective for this child's AGENT_PROGRESS.md. Must not define permanent mission, scope, policy, or success criteria."
            }
          },
          "required": ["relative_dir", "mission"],
          "additionalProperties": false
        }
      },
      "overwrite": {
        "type": "boolean",
        "default": false,
        "description": "If true, existing files in any node are replaced. If false, pre-existing parent and child contracts are skipped and patched or verified only after upstream and hierarchy compatibility checks pass; incompatible existing contracts abort."
      }
    },
    "required": ["parent_dir", "parent_mission", "children"],
    "additionalProperties": false
  },
  "outputSchema": {
    "type": "object",
    "properties": {
      "parent_dir": {
        "type": "string"
      },
      "parent_name": {
        "type": "string"
      },
      "children_created": {
        "type": "array",
        "items": { "type": "string" },
        "description": "Absolute paths of child directories successfully scaffolded or verified as compatible."
      },
      "files_created": {
        "type": "object",
        "additionalProperties": {
          "type": "array",
          "items": { "type": "string" }
        },
        "description": "Per-node files created. Keyed by node absolute path; value is list of files written."
      },
      "files_skipped": {
        "type": "object",
        "additionalProperties": {
          "type": "array",
          "items": { "type": "string" }
        },
        "description": "Per-node files skipped because they already existed and overwrite was false."
      },
      "patches_applied": {
        "type": "object",
        "additionalProperties": {
          "type": "array",
          "items": { "type": "string" }
        },
        "description": "Per-node patch names applied or verified after the base files were placed. Expected parent patches: ['progress_scope_rule', 'parent_progress_seed']; parent_progress_seed is written after all child contracts succeed. Expected child patches: ['child_agent_md', 'child_outer_boundary']."
      },
      "warnings": {
        "type": "array",
        "items": { "type": "string" },
        "description": "Non-fatal issues: progress-scope rule already present, parent progress seed already present, child hierarchy clauses already present, node already had a compatible contract (files skipped, patches verified or applied). Missing required hierarchy sections are fatal, not warnings."
      }
    },
    "required": ["parent_dir", "parent_name", "children_created", "files_created", "files_skipped", "patches_applied", "warnings"],
    "additionalProperties": false
  }
}
