{
  "name": "manuscript_revision_agent_files_init",
  "title": "Manuscript Revision Agent Files",
  "description": "Scaffold manuscript-revision AGENT file templates into a target directory, with an optional REVISION_TASK.md sidecar for joint manuscript and response-letter drafting",
  "inputSchema": {
    "type": "object",
    "properties": {
      "target_dir": {
        "type": "string",
        "minLength": 1,
        "description": "Directory where the manuscript-revision agent files will be scaffolded"
      },
      "mission": {
        "type": "string",
        "minLength": 1,
        "description": "One- or two-sentence long-term manuscript-revision mission statement written into AGENT_GOAL.md. Required so the scaffolded contract is internally consistent on first read; must not include workflow preferences, current state, next steps, transient response-letter tasks, or transient objectives"
      },
      "objective": {
        "type": "string",
        "minLength": 1,
        "description": "Concrete transient in-flight manuscript/revision objective written into AGENT_PROGRESS.md. Must not define permanent mission, manuscript scope, policy, or success criteria. If omitted, the scaffolded AGENT_PROGRESS.md omits the Current Objective section entirely"
      },
      "revision_mode": {
        "type": "string",
        "enum": [
          "manuscript_only",
          "manuscript_and_response_letter"
        ],
        "default": "manuscript_only",
        "description": "Controls whether the scaffold includes only the four core AGENT files or also adds REVISION_TASK.md for joint manuscript and response-letter revision work"
      },
      "overwrite": {
        "type": "boolean",
        "default": false,
        "description": "If true, existing scaffold files in target_dir are replaced; if false, only compatible existing files are recorded as skipped after boundary-contract inspection"
      }
    },
    "required": [
      "target_dir",
      "mission"
    ],
    "additionalProperties": false
  },
  "outputSchema": {
    "type": "object",
    "properties": {
      "target_dir": {
        "type": "string"
      },
      "files_created": {
        "type": "array",
        "items": {
          "type": "string"
        }
      },
      "files_skipped": {
        "type": "array",
        "items": {
          "type": "string"
        }
      }
    },
    "required": [
      "target_dir",
      "files_created",
      "files_skipped"
    ],
    "additionalProperties": false
  }
}
