{
  "name": "agent_files_init",
  "title": "Agent File Scaffold",
  "description": "Scaffold AGENT.md, AGENT_GOAL.md, AGENT_HARNESS.md, and AGENT_PROGRESS.md templates into a target directory under a strict four-file contract with AGENT.md immutable after scaffold",
  "inputSchema": {
    "type": "object",
    "properties": {
      "target_dir": {
        "type": "string",
        "minLength": 1,
        "description": "Directory where the four agent files will be scaffolded"
      },
      "mission": {
        "type": "string",
        "minLength": 1,
        "description": "One- or two-sentence long-term mission statement written into AGENT_GOAL.md. Required so the scaffolded contract is internally consistent on first read; must not include workflow preferences, current state, next steps, or transient objectives"
      },
      "objective": {
        "type": "string",
        "minLength": 1,
        "description": "Concrete transient in-flight objective written into AGENT_PROGRESS.md. Must not define permanent mission, scope, policy, or success criteria. If omitted, the scaffolded AGENT_PROGRESS.md omits the Current Objective section entirely"
      },
      "overwrite": {
        "type": "boolean",
        "default": false,
        "description": "If true, existing files in target_dir are replaced as an explicit scaffold overwrite; if false, only compatible existing files are recorded as skipped after hardened boundary-contract inspection, including AGENT.md immutability, current precedence, boundary-audit, neutral-scaffold, and dispatcher semantics"
      }
    },
    "required": ["target_dir", "mission"],
    "additionalProperties": false
  },
  "outputSchema": {
    "type": "object",
    "properties": {
      "target_dir": {
        "type": "string"
      },
      "files_created": {
        "type": "array",
        "items": {
          "type": "string"
        }
      },
      "files_skipped": {
        "type": "array",
        "items": {
          "type": "string"
        }
      }
    },
    "required": ["target_dir", "files_created", "files_skipped"],
    "additionalProperties": false
  }
}
