{
  "name": "web_scrape",
  "title": "Website Scraper",
  "description": "Extract structured data from a webpage",
  "inputSchema": {
    "type": "object",
    "properties": {
      "url": {
        "type": "string",
        "format": "uri"
      }
    },
    "required": [
      "url"
    ],
    "additionalProperties": false
  },
  "outputSchema": {
    "type": "object",
    "properties": {
      "data": {
        "type": "array",
        "items": {
          "type": "object"
        }
      }
    },
    "required": [
      "data"
    ],
    "additionalProperties": false
  }
}
