{
  "name": "write_ieee_comsoc_related_work",
  "title": "IEEE ComSoc Related Work Writer",
  "description": "Plan, review, or revise an IEEE ComSoc Related Work section from manuscript-defined comparisons, primary sources, and an iterative literature ledger",
  "inputSchema": {
    "type": "object",
    "properties": {
      "project_dir": {
        "type": "string",
        "minLength": 1,
        "description": "Project root containing the manuscript and any local literature ledger"
      },
      "manuscript_path": {
        "type": "string",
        "minLength": 1,
        "description": "Path to the manuscript source containing the Introduction and Related Work section"
      },
      "mode": {
        "type": "string",
        "enum": [
          "plan",
          "review",
          "rewrite"
        ],
        "default": "rewrite",
        "description": "Whether to propose a structure, audit existing prose, or revise the manuscript"
      },
      "request": {
        "type": "string",
        "minLength": 1,
        "description": "User instructions, scope boundaries, and venue-specific constraints"
      },
      "source_note_paths": {
        "type": "array",
        "items": {
          "type": "string",
          "minLength": 1
        },
        "uniqueItems": true,
        "description": "Optional literature ledgers or source notes, including REFERENCES.md, REFERENCE.md, or equivalent files; these preserve research history but do not replace primary-source verification"
      },
      "subsection_titles": {
        "type": "array",
        "items": {
          "type": "string",
          "minLength": 1
        },
        "minItems": 1,
        "uniqueItems": true,
        "description": "Optional fixed subsection titles that must be preserved"
      },
      "word_budget_per_subsection": {
        "type": "integer",
        "minimum": 1,
        "description": "Confirmed text-word budget for each subsection; omit when no limit has been established so the skill can open its length-confirmation gate"
      },
      "preserve_citation_set": {
        "type": "boolean",
        "default": true,
        "description": "Whether the rewrite must retain the existing citation keys"
      },
      "build_command": {
        "type": "string",
        "minLength": 1,
        "description": "Optional repository-approved manuscript build command"
      }
    },
    "required": [
      "project_dir",
      "manuscript_path",
      "request"
    ],
    "additionalProperties": false
  },
  "outputSchema": {
    "type": "object",
    "properties": {
      "section_path": {
        "type": "string"
      },
      "subsection_axes": {
        "type": "array",
        "items": {
          "type": "string"
        }
      },
      "files_modified": {
        "type": "array",
        "items": {
          "type": "string"
        }
      },
      "word_counts": {
        "type": "object",
        "additionalProperties": {
          "type": "integer",
          "minimum": 0
        }
      },
      "validation": {
        "type": "array",
        "items": {
          "type": "string"
        }
      },
      "warnings": {
        "type": "array",
        "items": {
          "type": "string"
        }
      },
      "open_questions": {
        "type": "array",
        "items": {
          "type": "string"
        }
      }
    },
    "required": [
      "section_path",
      "subsection_axes",
      "files_modified",
      "word_counts",
      "validation",
      "warnings",
      "open_questions"
    ],
    "additionalProperties": false
  }
}
